{
  "kind": "provider-registry",
  "schema_version": 2,
  "example": true,
  "canonicalization": "bllt-canonical-json-v1",
  "records": [
    {
      "record_id": "reg-sp-show",
      "destination": "spotify",
      "entity_type": "show",
      "entity_id": "example-show-en",
      "url_kind": "show-page",
      "external_url": "https://open.example.invalid/show/x",
      "external_id": null,
      "status": "listed",
      "observed_at": "2026-10-06T19:00:00Z",
      "receipt_id": null,
      "supersedes_record_id": null,
      "note": "EXAMPLE ONLY"
    },
    {
      "record_id": "reg-sp-profile",
      "destination": "spotify",
      "entity_type": "show",
      "entity_id": "example-show-en",
      "url_kind": "creator-profile",
      "external_url": "https://creators.example.invalid/pod/x",
      "external_id": null,
      "status": "listed",
      "observed_at": "2026-10-06T19:00:00Z",
      "receipt_id": null,
      "supersedes_record_id": null,
      "note": "EXAMPLE ONLY"
    },
    {
      "record_id": "reg-sp-rss",
      "destination": "spotify",
      "entity_type": "show",
      "entity_id": "example-show-en",
      "url_kind": "rss-feed",
      "external_url": "https://feeds.example.invalid/x.xml",
      "external_id": null,
      "status": "listed",
      "observed_at": "2026-10-06T19:00:00Z",
      "receipt_id": null,
      "supersedes_record_id": null,
      "note": "EXAMPLE ONLY"
    },
    {
      "record_id": "reg-sp-ep1",
      "destination": "spotify",
      "entity_type": "episode",
      "entity_id": "lion-and-mouse.en",
      "url_kind": "episode-page",
      "external_url": "https://open.example.invalid/episode/y",
      "external_id": null,
      "status": "listed",
      "observed_at": "2026-10-06T19:00:00Z",
      "receipt_id": null,
      "supersedes_record_id": null,
      "note": "EXAMPLE ONLY"
    },
    {
      "record_id": "reg-sp-enc1",
      "destination": "spotify",
      "entity_type": "episode",
      "entity_id": "lion-and-mouse.en",
      "url_kind": "enclosure",
      "external_url": "https://media.example.invalid/ep1-a.mp3",
      "external_id": null,
      "status": "listed",
      "observed_at": "2026-10-06T19:00:00Z",
      "receipt_id": null,
      "supersedes_record_id": null,
      "note": "EXAMPLE ONLY"
    },
    {
      "record_id": "reg-sp-embed1",
      "destination": "spotify",
      "entity_type": "episode",
      "entity_id": "lion-and-mouse.en",
      "url_kind": "embed",
      "external_url": "https://open.example.invalid/embed/episode/y",
      "external_id": null,
      "status": "listed",
      "observed_at": "2026-10-06T19:00:00Z",
      "receipt_id": null,
      "supersedes_record_id": null,
      "note": "EXAMPLE ONLY"
    },
    {
      "record_id": "reg-ap-show",
      "destination": "apple",
      "entity_type": "show",
      "entity_id": "example-show-en",
      "url_kind": "show-page",
      "external_url": "https://podcasts.example.invalid/x/id0",
      "external_id": null,
      "status": "listed",
      "observed_at": "2026-10-06T19:00:00Z",
      "receipt_id": null,
      "supersedes_record_id": null,
      "note": "EXAMPLE ONLY"
    },
    {
      "record_id": "reg-am-show",
      "destination": "amazon",
      "entity_type": "show",
      "entity_id": "example-show-en",
      "url_kind": null,
      "external_url": null,
      "external_id": null,
      "status": "verification_needed",
      "observed_at": "2026-10-06T19:00:00Z",
      "receipt_id": null,
      "supersedes_record_id": null,
      "note": "EXAMPLE ONLY"
    },
    {
      "record_id": "reg-pc-show",
      "destination": "pocket_casts",
      "entity_type": "show",
      "entity_id": "example-show-en",
      "url_kind": null,
      "external_url": null,
      "external_id": null,
      "status": "not_submitted",
      "observed_at": "2026-10-06T19:00:00Z",
      "receipt_id": null,
      "supersedes_record_id": null,
      "note": "EXAMPLE ONLY"
    },
    {
      "record_id": "reg-yt-v1",
      "destination": "youtube",
      "entity_type": "video",
      "entity_id": "lion-and-mouse.en",
      "url_kind": "video-page",
      "external_url": "https://video.example.invalid/watch/z",
      "external_id": null,
      "status": "listed",
      "observed_at": "2026-10-06T19:00:00Z",
      "receipt_id": null,
      "supersedes_record_id": null,
      "note": "EXAMPLE ONLY"
    }
  ]
}
